{
  "$schema": "../../../schemas/plugin-manifest.schema@1.1.0.json",
  "id": "layout-admin",
  "name": "Layout Administration",
  "version": "1.0.0",
  "main": "./index.js",
  "route": "/admin/layouts",
  "license": "MIT",
  "coreAPI": "1.0.0",
  "activationEvents": ["onStartupFinished", "onShiftChange"],
  "contributes": {
    "actions": [],
    "routes": [],
    "transforms": [],
    "shortcuts": [],
    "adminPanels": [
      {
        "id": "layouts",
        "title": "Layouts",
        "requiredDomains": ["layouts"],
        "requiredScopes": ["layouts:read", "layouts:write"],
        "latency": "interactive"
      }
    ]
  }
}

